commitment_id,commitment_name,initiative,commitment_type,owner,due_date,status,priority,value_amount,source_system,source_record_id,escalation_level,notes
COM-AG-001,Finalize Spring Appeal segmentation,INI-AG-SPRING,Operational,Annual Giving Manager,2026-06-03,Overdue,High,0,Planner,PLAN-SPRING-SEG-014,Manager,Segmentation approval is overdue and may delay final audience selection.
COM-AG-002,Complete donor follow-up batch for early responders,INI-AG-SPRING,Donor Follow-Up,Development Officer,2026-06-10,Overdue,Medium,15000,RE NXT Actions,ACT-AG-2026-044,Manager,Relationship activity is referenced from RE NXT Actions; FCC tracks the commitment outcome only.
COM-AG-003,Send stewardship note for leadership annual donor,INI-AG-SPRING,Stewardship,Stewardship Officer,2026-06-21,Open,Medium,5000,RE NXT Actions,ACT-AG-2026-057,None,Follow-up is due after appeal response confirmation.
COM-MG-001,Prepare principal gift briefing package,INI-MG-PGP,Executive Briefing,Principal Gifts Director,2026-06-01,Overdue,High,1000000,Planner,PLAN-MG-BRIEF-008,Director,Briefing materials remain incomplete pending prospect research and finance input.
COM-MG-002,Schedule next strategy discussion for principal gift opportunity,INI-MG-PGP,Donor Follow-Up,Major Gifts Officer,2026-06-17,Open,High,2500000,RE NXT Actions,ACT-MG-2026-091,None,Relationship activity remains in RE NXT Actions; FCC references the source only.
COM-MG-003,Submit draft proposal language for internal review,INI-MG-PGP,Proposal,Major Gifts Officer,2026-06-28,Open,High,2500000,RE NXT,OPP-MG-2026-118,None,Proposal readiness depends on case for support approval.
